web_url,snippet,source,keywords,pub_date,word_count,headline.main,headline.kicker,headline.content_kicker,headline.print_headline,headline.name,headline.seo,headline.sub,byline.original,byline.organization,title,index,original_title,budget,original_language,homepage,overview,popularity,runtime,revenue,release_date,vote_average,vote_count,generes,spoken_language,production_countries
https://www.nytimes.com/2020/02/28/movies/all-the-bright-places-review.html,Elle Fanning and Justice Smith breathe life into a film about mental illness and the healing power of love.,The New York Times,"name: subject, value: Movies, rank: 1, major: N, name: creative_works, value: All the Bright Places (Movie), rank: 2, major: N, name: persons, value: Haley, Brett, rank: 3, major: N, name: persons, value: Fanning, Elle, rank: 4, major: N, name: persons, value: Smith, Justice (1995- ), rank: 5, major: N, name: organizations, value: Netflix Inc, rank: 6, major: N",2020-02-28T08:01:07+0000,233,‘All the Bright Places’ Review: Love Amid Trauma,Streaming Movie Review,,A Refreshing Exploration of Mental Illness,,,,By Candice Frederick,,All the Bright Places,191.0,All the Bright Places,0.0,en,https://www.netflix.com/title/80208802,Two teens facing personal struggles form a powerful bond as they embark on a cathartic journey chronicling the wonders of Indiana.,40.552,108.0,0.0,2020-02-28,7.65,2813.0,"Romance, Drama",English,United States of America
https://www.nytimes.com/2020/02/13/movies/the-photograph-review.html,Issa Rae and a terrific Lakeith Stanfield play a New York couple whose romance sends them and the story into the past.,The New York Times,"name: subject, value: Movies, rank: 1, major: N, name: creative_works, value: The Photograph (Movie), rank: 2, major: N, name: persons, value: Meghie, Stella, rank: 3, major: N, name: persons, value: Rae, Issa, rank: 4, major: N, name: persons, value: Stanfield, Lakeith, rank: 5, major: N",2020-02-13T20:54:33+0000,862,‘The Photograph’ Review: An Unabashedly Old-School Love Story,,,An Unabashedly Old-School Love Story,,,,By Manohla Dargis,,The Photograph,193.0,The Photograph,16000000.0,en,https://www.thephotographmovie.com/,"When famed photographer Christina Eames dies unexpectedly, she leaves her estranged daughter, Mae, hurt, angry and full of questions. When Mae finds a photograph tucked away in a safe-deposit box, she soon finds herself delving into her mother's early life -- an investigation that leads to an unexpected romance with a rising journalist.",9.107,106.0,20690779.0,2020-02-14,6.409,203.0,"Drama, Romance",English,"Canada, United States of America"
https://www.nytimes.com/2020/02/13/movies/you-go-to-my-head-review.html,A mysterious architect persuades an amnesiac that she’s his wife in this elusive romance set in the Sahara.,The New York Times,"name: subject, value: Movies, rank: 1, major: N, name: creative_works, value: You Go to My Head (Movie), rank: 2, major: N, name: persons, value: de Clercq, Dimitri, rank: 3, major: N",2020-02-13T12:00:05+0000,292,‘You Go to My Head’ Review: Untrue Love,Critic’s Pick,,Designing a Love Story,,,,By Jeannette Catsoulis,,You Go to My Head,,,,,,,,,,,,,nan,nan,nan
https://www.nytimes.com/2020/02/12/movies/ordinary-love-review.html,Lesley Manville and Liam Neeson play a married couple facing a cancer diagnosis.,The New York Times,"name: subject, value: Movies, rank: 1, major: N, name: creative_works, value: Ordinary Love (Movie), rank: 2, major: N, name: persons, value: Neeson, Liam, rank: 3, major: N, name: persons, value: Manville, Lesley, rank: 4, major: N, name: persons, value: ""DSa, Lisa Barros"", rank: 5, major: N, name: persons, value: Leyburn, Glenn, rank: 6, major: N",2020-02-12T19:46:45+0000,569,‘Ordinary Love’ Review: In Sickness and in Health,,,Old-Sweater Lives,,,,By A.O. Scott,,Ordinary Love,197.0,Ordinary Love,0.0,en,https://bleeckerstreetmedia.com/ordinary-love-film,An extraordinary look at the lives of a middle-aged couple in the midst of the wife's breast cancer diagnosis.,10.708,92.0,0.0,2019-12-06,6.877,134.0,"Drama, Romance",English,"Ireland, United Kingdom"
https://www.nytimes.com/2020/02/11/movies/to-all-the-boys-ps-i-still-love-you-review.html,The second installment in Netflix’s ’80s-style teen romance trilogy asks the question John Hughes left unanswered.,The New York Times,"name: subject, value: Movies, rank: 1, major: N, name: persons, value: Condor, Lana, rank: 2, major: N, name: persons, value: Centineo, Noah, rank: 3, major: N, name: creative_works, value: To All the Boys: PS I Still Love You (Movie), rank: 4, major: N, name: persons, value: Fimognari, Michael, rank: 5, major: N",2020-02-11T18:33:41+0000,654,"‘To All the Boys: P.S. I Still Love You’ Review: Bliss, for Now",Streaming Movie Review,,"Follow Your Bliss While It Lasts, Kids",,,,By Amy Nicholson,,To All the Boys: P.S. I Still Love You,199.0,To All the Boys: P.S. I Still Love You,0.0,en,https://www.netflix.com/title/81030842,Lara Jean and Peter have just taken their romance from pretend to officially real when another recipient of one of her love letters enters the picture.,27.809,102.0,0.0,2020-02-03,6.848,2492.0,"Romance, Comedy",English,United States of America
https://www.nytimes.com/2020/01/09/movies/the-woman-who-loves-giraffes-review.html,"This warm documentary uses one woman’s singular passion to fuel a tale of zoological discovery, blatant sexism and environmental alarm.",The New York Times,"name: subject, value: Documentary Films and Programs, rank: 1, major: N, name: subject, value: Giraffes, rank: 2, major: N, name: creative_works, value: The Woman Who Loves Giraffes (Movie), rank: 3, major: N, name: persons, value: Dagg, Anne Innis, rank: 4, major: N, name: persons, value: Reid, Alison (Filmmaker), rank: 5, major: N",2020-01-09T12:00:04+0000,279,‘The Woman Who Loves Giraffes’ Review: Crackers for Animals,,,A Special Spot  In Her Heart,,,,By Jeannette Catsoulis,,The Woman Who Loves Giraffes,201.0,The Woman Who Loves Giraffes,0.0,en,,"Dr. Anne Innis Dagg re-traces the steps of her groundbreaking 1956 journey to South Africa to study giraffes in the wild. Now, at 85 years old, Anne sees a startling contrast between the world of giraffes she once knew and the one it has become. Weaving through the past and present, her harrowing journey gives us an intimate look into the factors that destroyed her career and the forces that brought her back.",2.46,81.0,0.0,2018-10-03,6.7,16.0,Documentary,,"Canada, South Africa, United States of America"
https://www.nytimes.com/2019/11/26/movies/queen-and-slim-review.html,Daniel Kaluuya and Jodie Turner-Smith star in Melina Matsoukas’s dreamy but intense outlaw romance.,The New York Times,"name: subject, value: Movies, rank: 1, major: N, name: creative_works, value: Queen & Slim (Movie), rank: 2, major: N, name: persons, value: Matsoukas, Melina, rank: 3, major: N, name: persons, value: Waithe, Lena, rank: 4, major: N, name: persons, value: Kaluuya, Daniel, rank: 5, major: N, name: persons, value: Turner-Smith, Jodie, rank: 6, major: N",2019-11-26T17:41:50+0000,799,‘Queen & Slim’ Review: Love on the Run,critic’s pick,,Love Simmers Inside a Cauldron,,,,By A.O. Scott,,Queen & Slim,,,,,,,,,,,,,nan,nan,nan
https://www.nytimes.com/2019/11/05/movies/marriage-story-review.html,"Adam Driver and Scarlett Johansson self-consciously uncouple in Noah Baumbach’s tender, stinging tale of divorce.",The New York Times,"name: subject, value: Movies, rank: 1, major: N, name: persons, value: Baumbach, Noah, rank: 2, major: N, name: creative_works, value: Marriage Story (Movie), rank: 3, major: N, name: persons, value: Driver, Adam, rank: 4, major: N, name: persons, value: Johansson, Scarlett, rank: 5, major: N, name: persons, value: Alda, Alan, rank: 6, major: N, name: persons, value: Dern, Laura, rank: 7, major: N, name: persons, value: Liotta, Ray, rank: 8, major: N",2019-11-05T19:01:02+0000,1244,‘Marriage Story’ Review: Dance Me to the End of Love,critic’s pick,,"Friendly Split, Shattering Break",,,,By A.O. Scott,,Marriage Story,205.0,Marriage Story,18000000.0,en,https://www.marriagestorymovie.com,"A stage director and an actress struggle through a grueling, coast-to-coast divorce that pushes them to their personal extremes.",41.069,137.0,2300000.0,2019-09-28,7.743,6794.0,Drama,English,United Kingdom
https://www.nytimes.com/2019/10/17/movies/cyrano-my-love-review.html,This superficial take on the writing and initial staging of “Cyrano de Bergerac” is a whirlwind of soapy declarations and backstage chaos.,The New York Times,"name: subject, value: Movies, rank: 1, major: N, name: creative_works, value: Cyrano, My Love (Movie), rank: 2, major: N, name: persons, value: Michalik, Alexis, rank: 3, major: N",2019-10-17T11:00:03+0000,291,"‘Cyrano, My Love’ Review: A Nose for Romance",,,"Cyrano, My Love",,,,By Jeannette Catsoulis,,"Cyrano, My Love",207.0,Edmond,9208475.0,fr,http://roadsideattractions.com/filmography/cyranomylove,"Paris, France, December 1897. The young playwright Edmond Rostand feels like a failure. Inspiration has abandoned him. Married and father of two children, desperate and penniless, he persuades the great actor Constant Coquelin to perform the main role in his new play. But there is a problem: Coquelin wants to premiere it at Christmas and Edmond has not written a single word.",8.867,113.0,0.0,2018-11-10,7.501,488.0,"Comedy, History","French, Russian","Belgium, France"
https://www.nytimes.com/2019/10/03/movies/pretenders-review.html,"Directed by James Franco and featuring James Franco, this film indulges in a distasteful brand of nostalgia.",The New York Times,"name: subject, value: Movies, rank: 1, major: N, name: persons, value: Franco, James, rank: 2, major: N, name: creative_works, value: Pretenders (Movie), rank: 3, major: N",2019-10-03T11:00:07+0000,276,"‘Pretenders’ Review: A Little New Wave Love, a Lot of Misogyny",,,Pretenders,,,,By Glenn Kenny,,Pretenders,209.0,Pretenders,0.0,en,,"A love triangle involving a photographer, a director and an actress.",4.883,95.0,0.0,2019-09-27,5.6,13.0,Drama,English,United States of America
https://www.nytimes.com/2019/09/26/movies/first-love-review.html,The prolific director Takashi Miike delivers an unusually satisfying Japanese genre romp.,The New York Times,"name: subject, value: Movies, rank: 1, major: N, name: persons, value: Miike, Takashi, rank: 2, major: N, name: creative_works, value: First Love (Movie), rank: 3, major: N",2019-09-26T11:00:06+0000,398,‘First Love’ Review: Eluding Assassins With the Help of a Boxer,Critic’s Pick,,"Assassin Variations, by Way of Japan",,,,By Glenn Kenny,,First Love,211.0,初恋,0.0,ja,,"Set over one night in Tokyo, we follow Leo, a young boxer down on his luck as he meets his ‘first love’ Monica, a call-girl and an addict but still innocent. But, little does Leo know, Monica is unwittingly caught up in a drug-smuggling scheme, and the two are pursued through the night by a corrupt cop, a yakuza, his nemesis, and a female assassin sent by the Chinese Triads. All their fates intertwine in spectacular Miike style, at his most fun and anarchic.",14.055,108.0,0.0,2019-05-31,6.696,291.0,"Crime, Action, Comedy","Mandarin, Japanese","Japan, United Kingdom"
https://www.nytimes.com/2019/09/19/movies/loro-review.html,Toni Servillo plays the former Italian Prime Minister Silvio Berlusconi in Paolo Sorrentino’s extravagant portrait.,The New York Times,"name: subject, value: Movies, rank: 1, major: N, name: creative_works, value: Loro (Movie), rank: 2, major: N, name: persons, value: Servillo, Toni, rank: 3, major: N, name: persons, value: Sorrentino, Paolo, rank: 4, major: N, name: persons, value: Berlusconi, Silvio, rank: 5, major: N, name: glocations, value: Italy, rank: 6, major: N",2019-09-19T17:27:07+0000,820,"‘Loro’ Review: A Corrupt Leader, and the People Who Love Him",,,Corruption and Charisma Personified,,,,By A.O. Scott,,Loro,213.0,Loro,0.0,it,,"Internationally released Director's Cut of ""Loro 1"" and ""Loro 2"", which were released separately as two movies in Italy. The film talks about the group of businessmen and politicians – the Loro (Them) from the title – who live and act near to media tycoon and politician Silvio Berlusconi in the years between 2006 and 2009.",12.819,157.0,0.0,2018-09-13,6.711,282.0,Drama,Italian,"France, Italy"
https://www.nytimes.com/2019/08/29/movies/falling-inn-love-review.html,"It’s hard to find a reliable, talented, reasonably priced, eco-friendly contractor these days.",The New York Times,"name: subject, value: Movies, rank: 1, major: N, name: organizations, value: Netflix Inc, rank: 2, major: N, name: persons, value: Kumble, Roger, rank: 3, major: N, name: persons, value: Milian, Christina, rank: 4, major: N, name: persons, value: Demos, Adam, rank: 5, major: N, name: creative_works, value: Falling Inn Love (Movie), rank: 6, major: N",2019-08-29T14:56:44+0000,374,‘Falling Inn Love’ Review: A Prize That Needs Some Work,Streaming Movie Review,,A Fine Romance to Watch While Sorting Socks,,,,By Helen T. Verongos,,Falling Inn Love,215.0,Falling Inn Love,0.0,en,https://www.netflix.com/title/80999781,"When a San Francisco exec wins a New Zealand inn, she ditches city life to remodel and flip the rustic property with help from a handsome contractor.",14.472,98.0,0.0,2019-08-29,6.52,1134.0,"Romance, Comedy",English,United States of America
https://www.nytimes.com/2019/08/22/movies/hot-air-review.html,Steve Coogan stars in this cumbersome political comedy.,The New York Times,"name: subject, value: Movies, rank: 1, major: N, name: persons, value: Coogan, Steve, rank: 2, major: N, name: persons, value: Coraci, Frank, rank: 3, major: N, name: creative_works, value: Hot Air (Movie), rank: 4, major: N, name: persons, value: Campbell, Neve, rank: 5, major: N",2019-08-22T15:50:09+0000,266,‘Hot Air’ Review: A Right-Wing Radio Host Learns to Love Again,,,Hot Air,,,,By Bilge Ebiri,,Hot Air,217.0,Hot Air,0.0,en,,A right-wing talk show host's life takes a sudden turn when his 16-year-old niece comes crashing into his life.,6.027,99.0,0.0,2018-04-10,5.184,19.0,Drama,English,United States of America
https://www.nytimes.com/2019/08/08/movies/love-anthosa-review.html,"Anton Yelchin, who played Chekov in the J.J. Abrams-produced “Star Trek” films, assembled an eclectic filmography before his death at 27 in 2016.",The New York Times,"name: subject, value: Documentary Films and Programs, rank: 1, major: N, name: creative_works, value: Love, Antosha (Movie), rank: 2, major: N, name: persons, value: Price, Garret, rank: 3, major: N, name: persons, value: Yelchin, Anton, rank: 4, major: N",2019-08-08T09:00:10+0000,319,"‘Love, Antosha’ Review: A Heartbreaking Look at an Actor’s Too-Short Life",Critic’s Pick,,"Love, Antosha",,,,By Glenn Kenny,,"Love, Antosha",219.0,"Love, Antosha",0.0,en,https://antonyelchindoc.com/,"From a prolific career in film and television, Anton Yelchin left an indelible legacy as an actor. Through his journals and other writings, his photography, the original music he wrote, and interviews with his family, friends, and colleagues, this film looks not just at Anton's impressive career, but at a broader portrait of the man.",6.725,92.0,0.0,2019-08-02,7.25,50.0,Documentary,"English, Russian",United States of America
https://www.nytimes.com/2019/06/06/movies/leto-review.html,Kirill Serebrennikov’s gentle mood piece brings an underground music scene to vivid life.,The New York Times,"name: subject, value: Music, rank: 1, major: N, name: creative_works, value: Leto (Movie), rank: 2, major: N, name: persons, value: Serebrennikov, Kirill S, rank: 3, major: N",2019-06-06T11:00:02+0000,283,‘Leto’ Review: Love and Rock in Leningrad,Critic’s Pick,,Leto,,,,By Jeannette Catsoulis,,Leto,,,,,,,,,,,,,nan,nan,nan
https://www.nytimes.com/2019/05/21/movies/the-tomorrow-man-review.html,Blythe Danner and John Lithgow strain to elevate this twee late-life romance.,The New York Times,"name: subject, value: Movies, rank: 1, major: N, name: creative_works, value: The Tomorrow Man (Movie), rank: 2, major: N, name: persons, value: Danner, Blythe, rank: 3, major: N, name: persons, value: Lithgow, John, rank: 4, major: N, name: persons, value: Jones, Noble, rank: 5, major: N",2019-05-21T11:00:01+0000,280,‘The Tomorrow Man’ Review: Love Among the Neuroses,,,"They Whirl, They Twirl, They Tango",,,,By Jeannette Catsoulis,,The Tomorrow Man,223.0,The Tomorrow Man,0.0,en,https://bleeckerstreetmedia.com/thetomorrowman,"Ed Hemsler spends his life preparing for a disaster that may never come. Ronnie Meisner spends her life shopping for things she may never use. In a small town somewhere in America, these two people will try to find love while trying not to get lost in each other’s stuff.",7.667,94.0,0.0,2019-05-22,5.746,59.0,"Drama, Romance",English,United States of America
https://www.nytimes.com/2019/05/16/movies/asako-i-and-ii-review.html,The Japanese director Ryusuke Hamaguchi follows up his marathon “Happy Hour” with a story of love among young urbanites.,The New York Times,"name: subject, value: Movies, rank: 1, major: N, name: creative_works, value: Asako I & II (Movie), rank: 2, major: N, name: persons, value: Hamaguchi, Ryusuke, rank: 3, major: N",2019-05-16T11:00:01+0000,547,‘Asako I & II’ Review: Double the Love (and the Heartbreak),Critic’s Pick,,Falling For a Drifter And His Lookalike,,,,By Glenn Kenny,,Asako I & II,225.0,寝ても覚めても,0.0,ja,http://www.netemosametemo.jp/,"College student Asako falls in love at first sight with Baku after meeting at a photography exhibit. Romance sparks between the two but doesn't last long when Baku suddenly disappears from her life. Two years later, she spots a man that bears a striking resemblance to him. Even though it is only his physical similarities to Baku that attracted her to him, she doesn't say so and starts dating the soft-spoken young man called Ryohei.",13.066,119.0,0.0,2018-09-01,6.799,169.0,"Drama, Romance","Japanese, English",Japan
https://www.nytimes.com/2019/05/15/movies/the-sun-is-also-a-star-review.html,"Yara Shahidi and Charles Melton play teenagers falling in love on a hectic, sunny day in New York.",The New York Times,"name: subject, value: Movies, rank: 1, major: N, name: creative_works, value: The Sun Is Also a Star (Movie), rank: 2, major: N, name: persons, value: Russo-Young, Ry, rank: 3, major: N, name: persons, value: Shahidi, Yara (2000- ), rank: 4, major: N, name: persons, value: Yoon, Nicola (Author), rank: 5, major: N, name: persons, value: Melton, Charles (1991- ), rank: 6, major: N",2019-05-15T16:01:27+0000,697,"‘The Sun Is Also a Star’ Review: A Charming, if Generic, Adolescent Love Story",,,A Beautiful Day for Young Hearts,,,,By A.O. Scott,,The Sun Is Also a Star,227.0,The Sun Is Also a Star,9000000.0,en,https://www.thesunisalsoastarmovie.com,"Two young New Yorkers begin to fall in love over the course of a single day, as a series of potentially life-altering meetings loom over their heads - hers concerning her family’s deportation to Jamaica, and his concerning an education at Dartmouth.",9.064,100.0,6800000.0,2019-05-16,6.975,570.0,"Romance, Drama",English,United States of America
https://www.nytimes.com/2019/05/10/movies/sheherazade-review.html,The options are few and most of them involve risk or further deprivation for these French teenagers who face the world with little support.,The New York Times,"name: subject, value: Movies, rank: 1, major: N, name: organizations, value: Netflix Inc, rank: 2, major: N, name: creative_works, value: Sheherazade (Movie), rank: 3, major: N, name: persons, value: Marlin, Jean-Bernard, rank: 4, major: N",2019-05-10T11:00:01+0000,350,‘Shéhérazade’ Review: Love in the Mean Streets of Marseille,Streaming Movie Review,,,,,,By Helen T. Verongos,,Shéhérazade,229.0,Shéhérazade,0.0,fr,,"Zachary, 17 years old, gets out of jail. Rejected by his mother, he hangs out in the mean streets of Marseille. He falls in love with Shéhérazade, a young prostitute of whom he becomes the pimp without realizing it...",8.55,106.0,0.0,2018-09-05,7.215,247.0,"Drama, Thriller, Romance",French,France
https://www.nytimes.com/2019/05/02/movies/long-shot-review.html,The improbably yet perfectly paired stars play old friends who unexpectedly find love in this charming (and a bit vulgar) romantic comedy.,The New York Times,"name: subject, value: Movies, rank: 1, major: N, name: subject, value: Comedy and Humor, rank: 2, major: N, name: persons, value: Odenkirk, Bob, rank: 3, major: N, name: persons, value: Rogen, Seth, rank: 4, major: N, name: persons, value: Theron, Charlize, rank: 5, major: N, name: creative_works, value: Long Shot (Movie), rank: 6, major: N, name: persons, value: Levine, Jonathan A (1976- ), rank: 7, major: N",2019-05-02T17:43:25+0000,1025,‘Long Shot’ Review: Charlize Theron and Seth Rogen Give Good Heart,Critic’s Pick,,Beating the Odds for Love and Bliss,,,,By Manohla Dargis,,Long Shot,231.0,Long Shot,40000000.0,en,https://longshot.movie,"Journalist Fred Flarsky reunites with his childhood crush, Charlotte Field, now one of the most influential women in the world. As she prepares to make a run for the Presidency, Charlotte hires Fred as her speechwriter — much to the dismay of her trusted advisers.",19.778,125.0,0.0,2019-05-02,6.733,2600.0,"Comedy, Romance","French, English, Swedish",United States of America
https://www.nytimes.com/2019/05/02/movies/clara-review.html,A ruthless empiricist searching for life beyond Earth learns a thing or two about life on the planet.,The New York Times,"name: subject, value: Movies, rank: 1, major: N, name: creative_works, value: Clara (Movie), rank: 2, major: N, name: persons, value: Adams, Patrick J, rank: 3, major: N, name: persons, value: Esmer, Ennis (1978- ), rank: 4, major: N, name: persons, value: Sherman, Akash, rank: 5, major: N",2019-05-02T11:00:04+0000,256,‘Clara’ Review: Love Means Never Having to Say You’re Starry,,,Clara,,,,By Ben Kenigsberg,,Clara,233.0,Clara,0.0,en,,An astronomer becomes obsessed with searching the cosmos for signs of life beyond Earth which leads to a shocking discovery.,12.004,106.0,0.0,2018-11-30,7.5,199.0,"Science Fiction, Drama, Romance","Spanish, English",Canada
https://www.nytimes.com/2019/04/19/movies/kalank-review.html,Abhishek Varman’s maximalist melodrama delivers spectacle (some of it mind-numbing) but fails to tell a gripping story.,The New York Times,"name: subject, value: Movies, rank: 1, major: N, name: creative_works, value: Kalank (Movie), rank: 2, major: N, name: persons, value: Varman, Abhishek, rank: 3, major: N",2019-04-19T15:38:08+0000,479,‘Kalank’ Review: A Bollywood Love Story in the Shadow of Partition,,,An Extravagant Spectacle,,,,By Rachel Saltz,,Kalank,235.0,कलंक,0.0,hi,,"Set in 1945, in Pre-Independent India, the elite, opulent and solemn world of the Chaudhry family, and the wild, mysterious and musical underbelly of the town, Hira Mandi, clash when Roop Chaudhry encounters Zafar, a daredevil from Hira Mandi, unleashing deep-buried truths, secrets of betrayal and affairs that threaten to bring both worlds crashing down.",13.798,166.0,0.0,2019-04-17,5.63,50.0,"Drama, Romance",Hindi,India
https://www.nytimes.com/2019/04/18/movies/rafiki-review.html,The story of a romance between two Kenyan women was shown at Cannes after being banned in Kenya.,The New York Times,"name: subject, value: Movies, rank: 1, major: N, name: persons, value: Kahiu, Wanuri, rank: 2, major: N, name: creative_works, value: Rafiki (Movie), rank: 3, major: N, name: persons, value: Mugatsia, Samantha, rank: 4, major: N, name: persons, value: Munyiva, Sheila, rank: 5, major: N",2019-04-18T11:00:06+0000,251,"‘Rafiki’ Review: Falling in Love, Illegally",,,Rafiki,,,,By Ben Kenigsberg,,Rafiki,237.0,Rafiki,0.0,sw,http://www.mpmfilm.com/rafiki-2/,"Kena and Ziki long for something more. Despite the political rivalry between their families, the girls resist and remain close friends, supporting each other to pursue their dreams in a conservative society. When love blossoms between them, the two girls will be forced to choose between happiness and safety.",7.833,82.0,181316.0,2018-09-26,7.029,138.0,"Drama, Romance","Swahili, English","Kenya, South Africa"
https://www.nytimes.com/2019/03/28/movies/diane-review.html,"Mary Kay Place is astonishing as a weary widow dealing with guilt, heartache and a diminishing circle of friends.",The New York Times,"name: subject, value: Movies, rank: 1, major: N, name: creative_works, value: Diane (Movie), rank: 2, major: N, name: persons, value: Jones, Kent, rank: 3, major: N, name: persons, value: Place, Mary Kay, rank: 4, major: N, name: persons, value: Parsons, Estelle, rank: 5, major: N, name: persons, value: Martin, Andrea (1947- ), rank: 6, major: N",2019-03-28T11:00:01+0000,511,"‘Diane’ Review: A Vibrant Tale of Love, Sisterhood and Decline",Critic’s Pick,,"A Vibrant Tale of Love, Sisterhood and Decline",,,,By Jeannette Catsoulis,,Diane,239.0,Diane,0.0,en,,"Asked by Francis I to tutor his son, Diane de Poitiers becomes the future King Henry II's mistress in 1500s France.",4.595,110.0,0.0,1956-01-12,5.7,8.0,"Drama, History, Romance",English,United States of America
