web_url,snippet,source,keywords,pub_date,word_count,headline.main,headline.kicker,headline.content_kicker,headline.print_headline,headline.name,headline.seo,headline.sub,byline.original,byline.organization,title,index,original_title,budget,original_language,homepage,overview,popularity,runtime,revenue,release_date,vote_average,vote_count,generes,spoken_language,production_countries
https://www.nytimes.com/2019/03/14/movies/five-feet-apart-review.html,Haley Lu Richardson and Cole Sprouse navigate the rules of attraction and of a hospital in this film about living with cystic fibrosis.,The New York Times,"name: subject, value: Movies, rank: 1, major: N, name: creative_works, value: Five Feet Apart (Movie), rank: 2, major: N, name: persons, value: Baldoni, Justin, rank: 3, major: N",2019-03-14T13:00:07+0000,258,‘Five Feet Apart’ Review: Ailing Teenagers Live Dangerously for Love,,,Five Feet Apart,,,,By Ben Kenigsberg,,Five Feet Apart,241.0,Five Feet Apart,7000000.0,en,,"Seventeen-year-old Stella spends most of her time in the hospital as a cystic fibrosis patient. Her life is full of routines, boundaries and self-control — all of which get put to the test when she meets Will, an impossibly charming teen who has the same illness. There's an instant flirtation, though restrictions dictate that they must maintain a safe distance between them. As their connection intensifies, so does the temptation to throw the rules out the window and embrace that attraction.",59.498,116.0,92600000.0,2019-03-14,8.267,5487.0,"Romance, Drama","English, French, Spanish",United States of America
https://www.nytimes.com/2019/03/13/movies/ash-is-purest-white-review.html,"In Jia Zhangke’s enthralling new feature, Zhao Tao and Liao Fan portray an underworld power couple at the mercy of time and fate.",The New York Times,"name: subject, value: Movies, rank: 1, major: N, name: persons, value: Jia Zhang Ke, rank: 2, major: N, name: persons, value: Liao Fan (1974- ), rank: 3, major: N, name: persons, value: Zhao Tao (1977- ), rank: 4, major: N, name: creative_works, value: Ash Is Purest White (Movie), rank: 5, major: N",2019-03-13T15:44:46+0000,911,‘Ash Is Purest White’ Review: Love Smolders and Crime Pays in a Changing China,Critic’s Pick,,"Gangsters’ Paradise Lost, in China",,,,By A.O. Scott,,Ash Is Purest White,243.0,江湖儿女,0.0,zh,,"Set in China's underworld, this tale of love and betrayal follows a dancer who fired a gun to protect her mobster boyfriend during a fight. On release from prison 5 years later, she sets out to find him.",13.281,141.0,0.0,2018-09-21,6.862,304.0,"Crime, Romance, Drama",Mandarin,"France, Japan, China"
https://www.nytimes.com/2019/03/07/movies/gloria-bell-review.html,The Chilean writer-director Sebastián Lelio finds a perfect partner in Moore for this fantastic remake of his 2013 movie “Gloria.”,The New York Times,"name: subject, value: Movies, rank: 1, major: N, name: creative_works, value: Gloria Bell (Movie), rank: 2, major: N, name: persons, value: Moore, Julianne, rank: 3, major: N, name: persons, value: Turturro, John, rank: 4, major: N, name: persons, value: Lelio, Sebastian, rank: 5, major: N",2019-03-07T18:49:47+0000,991,‘Gloria Bell’ Review: Love Is in the Air for a Transcendent Julianne Moore,Critic’s Pick,,"Love, and Some Laughter, Is in the Air",,,,By Manohla Dargis,,Gloria Bell,245.0,Gloria Bell,0.0,en,https://a24films.com/films/gloria-bell,"Gloria is a free-spirited divorcée who spends her days at a straight-laced office job and her nights on the dance floor, joyfully letting loose at clubs around Los Angeles. After meeting Arnold on a night out, she finds herself thrust into an unexpected new romance, filled with both the joys of budding love and the complications of dating, identity, and family.",15.627,102.0,11145006.0,2019-03-07,5.954,307.0,"Drama, Romance",English,"Chile, United States of America"
https://www.nytimes.com/2019/03/06/movies/black-mother-review.html,"In Khalik Allah’s poetic movie, the most prevalent perspective is not that of a documentarian, but of a filmmaker’s love.",The New York Times,"name: subject, value: Documentary Films and Programs, rank: 1, major: N, name: persons, value: Allah, Khalik (1985- ), rank: 2, major: N, name: creative_works, value: Black Mother (Movie), rank: 3, major: N",2019-03-06T18:30:16+0000,380,‘Black Mother’ Review: Exploring the Roots of Life Itself,Critic’s Pick,,"Exploring the Roots of Life Itself, With Love",,,,By Glenn Kenny,,Black Mother,247.0,Black Mother,0.0,en,https://dogwoof.com/blackmother,"Part film, part baptism, in BLACK MOTHER director Khalik Allah brings us on a spiritual journey through Jamaica. Soaking up its bustling metropolises and tranquil countryside, Allah introduces us to a succession of vividly rendered souls who call this island home. Their candid testimonies create a polyphonic symphony, set against a visual prayer of indelible portraiture. Thoroughly immersed between the sacred and profane, BLACK MOTHER channels rebellion and reverence into a deeply personal ode informed by Jamaica’s turbulent history but existing in the urgent present.",2.503,77.0,0.0,2018-11-02,6.6,15.0,Documentary,English,United States of America
https://www.nytimes.com/2019/02/28/movies/the-hole-in-the-ground-review.html,"Something strange is going on in the Irish countryside, and it’s not just the giant roiling pit of dirt.",The New York Times,"name: subject, value: Movies, rank: 1, major: N, name: creative_works, value: The Hole in the Ground (Movie), rank: 2, major: N, name: persons, value: Cronin, Lee (Film Director), rank: 3, major: N",2019-02-28T12:00:09+0000,291,‘The Hole in the Ground’ Review: A Horror Film Is Suffocated by a Mother’s Love,,,The Hole  in the Ground,,,,By Teo Bugbee,,The Hole in the Ground,249.0,The Hole in the Ground,0.0,en,,"Trying to escape her broken past, Sarah O’Neill is building a new life on the fringes of a backwood rural town with her young son Chris. A terrifying encounter with a mysterious neighbour shatters her fragile security, throwing Sarah into a spiralling nightmare of paranoia and mistrust, as she tries to uncover if the disturbing changes in her little boy are connected to an ominous sinkhole buried deep in the forest that borders their home.",14.177,90.0,3373474.0,2019-03-01,5.631,662.0,Horror,English,"Belgium, Finland, Ireland, United Kingdom"
https://www.nytimes.com/2019/02/20/movies/how-to-train-your-dragon-hidden-world-review.html,The third in this franchise concerns the exigencies that poor Hiccup must face as the leader of Berk.,The New York Times,"name: subject, value: Movies, rank: 1, major: N, name: persons, value: DeBlois, Dean, rank: 2, major: N, name: persons, value: Baruchel, Jay, rank: 3, major: N, name: persons, value: Abraham, F Murray, rank: 4, major: N, name: persons, value: Ferrera, America, rank: 5, major: N, name: creative_works, value: How to Train Your Dragon: The Hidden World (Movie), rank: 6, major: N",2019-02-21T00:02:36+0000,531,‘How to Train Your Dragon: The Hidden World’ Review: A Series Scales Up,,,Love Takes Wing Amid Trouble in Utopia,,,,By Ben Kenigsberg,,How to Train Your Dragon: The Hidden World,251.0,How to Train Your Dragon: The Hidden World,129000000.0,en,https://www.howtotrainyourdragon.com/,"As Hiccup fulfills his dream of creating a peaceful dragon utopia, Toothless’ discovery of an untamed, elusive mate draws the Night Fury away. When danger mounts at home and Hiccup’s reign as village chief is tested, both dragon and rider must make impossible decisions to save their kind.",88.189,104.0,524580592.0,2019-01-03,7.752,6207.0,"Animation, Family, Adventure",English,United States of America
https://www.nytimes.com/2019/02/14/movies/a-tuba-to-cuba-review.html,This joyous documentary follows the Preservation Hall Jazz Band to Cuba for a celebration of musical history and common bonds.,The New York Times,"name: subject, value: Documentary Films and Programs, rank: 1, major: N, name: creative_works, value: A Tuba to Cuba (Movie), rank: 2, major: N, name: persons, value: Herrington, TG, rank: 3, major: N, name: persons, value: Clinch, Danny, rank: 4, major: N, name: subject, value: Jazz, rank: 5, major: N, name: organizations, value: Preservation Hall Jazz Band, rank: 6, major: N",2019-02-14T12:00:01+0000,267,‘A Tuba to Cuba’ Review: A New Orleans Jazz Band Makes a Caribbean Connection,Critic’s Pick,,Love Notes Forge a Caribbean Bond,,,,By Jeannette Catsoulis,,A Tuba to Cuba,,,,,,,,,,,,,nan,nan,nan
https://www.nytimes.com/2019/02/13/movies/fighting-with-my-family-review.html,"Dwayne Johnson helped produce this charming comedy about a family of professional wrestlers, their chops, drops and drama.",The New York Times,"name: subject, value: Movies, rank: 1, major: N, name: creative_works, value: Fighting with My Family (Movie), rank: 2, major: N, name: persons, value: Merchant, Stephen, rank: 3, major: N, name: persons, value: Pugh, Florence, rank: 4, major: N, name: persons, value: Johnson, Dwayne (1972- ), rank: 5, major: N, name: persons, value: Headey, Lena, rank: 6, major: N, name: persons, value: Frost, Nick, rank: 7, major: N, name: persons, value: Vaughn, Vince, rank: 8, major: N, name: persons, value: Lowden, Jack (1990- ), rank: 9, major: N",2019-02-13T23:46:10+0000,759,"‘Fighting With My Family’ Review: They Body Slam You, Your Mum and Dad. Lovingly.",Critic’s Pick,,They Show Their Love With a Body Slam,,,,By Manohla Dargis,,Fighting With My Family,,,,,,,,,,,,,nan,nan,nan
https://www.nytimes.com/2019/02/12/movies/sorry-angel-review.html,"Set in early 1990s Paris, Christophe Honoré’s new film presents us with a middle-aged, H.I.V.-stricken writer falling, wearily, for a bookish 20-something.",The New York Times,"name: subject, value: Movies, rank: 1, major: N, name: creative_works, value: Sorry Angel (Movie), rank: 2, major: N, name: persons, value: Honore, Christophe, rank: 3, major: N",2019-02-12T21:46:52+0000,491,"‘Sorry Angel’ Review: A Love Affair Two Men Start, Knowing the End",Critic’s Pick,,Attraction: That’s the Easy Part,,,,By Glenn Kenny,,Sorry Angel,257.0,"Plaire, aimer et courir vite",0.0,fr,,Jacques is a writer living in Paris. He hasn't turned 40 but already mistrusts that the best in life is yet to come. Arthur is a student living in Brittany. He reads and smiles a lot and refuses to think that everything in life might not be possible. Jacques and Arthur will like each other. Just like in a lovely dream. Just like in a sad story.,16.946,132.0,1631910.0,2018-05-09,6.86,214.0,"Comedy, Drama, Romance","French, Spanish",France
https://www.nytimes.com/2019/02/07/movies/berlin-i-love-you-review.html,"The once-divided nature of Berlin isn’t given much consideration in this film, part of the Cities of Love series.",The New York Times,"name: subject, value: Movies, rank: 1, major: N, name: creative_works, value: Berlin, I Love You (Movie), rank: 2, major: N, name: persons, value: Agron, Dianna, rank: 3, major: N, name: persons, value: Knightley, Keira, rank: 4, major: N, name: persons, value: Luna, Diego, rank: 5, major: N, name: persons, value: Mirren, Helen, rank: 6, major: N, name: persons, value: Rourke, Mickey, rank: 7, major: N, name: persons, value: Wilson, Luke, rank: 8, major: N",2019-02-07T12:00:01+0000,227,"‘Berlin, I Love You’ Review: Many Stories, Not Much Feeling",,,"Berlin, I Love You",,,,By Glenn Kenny,,"Berlin, I Love You",259.0,"Berlin, I Love You",0.0,en,,An anthology feature of 10 stories of romance set in the German capital.,31.829,120.0,160000.0,2019-02-08,4.6,79.0,Drama,"English, German","Germany, United States of America"
https://www.nytimes.com/2019/02/07/movies/untogether-review.html,Jemima Kirke and Lola Kirke play damaged siblings in this exasperatingly affected romantic drama from Emma Forrest.,The New York Times,"name: subject, value: Movies, rank: 1, major: N, name: persons, value: Dornan, Jamie, rank: 2, major: N, name: persons, value: Kirke, Jemima, rank: 3, major: N, name: persons, value: Kirke, Lola, rank: 4, major: N, name: creative_works, value: Untogether (Movie), rank: 5, major: N, name: persons, value: Forrest, Emma, rank: 6, major: N",2019-02-07T12:00:01+0000,269,"‘Untogether’ Review: Adrift in Los Angeles, Looking for Love",,,Untogether,,,,By Jeannette Catsoulis,,Untogether,261.0,Untogether,0.0,en,,"Once considered a teen prodigy, a recovering addict sobers up and tries to get her writing career back on track. She begins a relationship with a rising author known for his wartime memoirs.",10.445,98.0,0.0,2019-02-08,5.489,44.0,"Comedy, Drama",English,United States of America
https://www.nytimes.com/2018/12/20/movies/cold-war-review.html,"In post-World War II Poland, a singer and a piano player find each other, fall in love and soon end up on opposite sides of history.",The New York Times,"name: subject, value: Movies, rank: 1, major: N, name: creative_works, value: Cold War (Movie), rank: 2, major: N, name: persons, value: Pawlikowski, Pawel, rank: 3, major: N, name: persons, value: Kot, Tomasz, rank: 4, major: N, name: persons, value: Kulesza, Agata, rank: 5, major: N, name: persons, value: Szyc, Borys, rank: 6, major: N, name: persons, value: Kulig, Joanna, rank: 7, major: N",2018-12-20T17:09:56+0000,981,‘Cold War’ Review: Love Without Borders,Critic’s Pick,,A Resonating Love Shall Guide You,,,,By Manohla Dargis,,Cold War,263.0,Zimna wojna,4954500.0,pl,https://www.curzonartificialeye.com/cold-war,"A man and a woman meet in the ruins of post-war Poland. With vastly different backgrounds and temperaments, they are fatally mismatched and yet drawn to each other.",16.451,88.0,18754051.0,2018-06-08,7.454,1436.0,"Drama, Romance, War, Music","German, Croatian, French, Italian, Polish, Russian","France, Poland, United Kingdom"
https://www.nytimes.com/2018/12/12/movies/if-beale-street-could-talk-review.html,"The couple in this adaptation of James Baldwin’s novel are loving while black, an existential truth that is turned into a nightmare.",The New York Times,"name: subject, value: Movies, rank: 1, major: N, name: creative_works, value: If Beale Street Could Talk (Movie), rank: 2, major: N, name: persons, value: Jenkins, Barry, rank: 3, major: N, name: persons, value: Baldwin, James (1924-87), rank: 4, major: N, name: persons, value: James, Stephan (1993- ), rank: 5, major: N, name: persons, value: Layne, KiKi, rank: 6, major: N, name: persons, value: Wittrock, Finn, rank: 7, major: N",2018-12-12T21:30:02+0000,1057,‘If Beale Street Could Talk’ Review: Trusting Love in a World Ruled by Hate,Critic’s Pick,,Love Is Forced to Live in a Nightmare,,,,By Manohla Dargis,,If Beale Street Could Talk,265.0,If Beale Street Could Talk,12000000.0,en,http://www.bealestreet.movie,"After her fiance is falsely imprisoned, a pregnant African-American woman sets out to clear his name and prove his innocence.",19.026,120.0,20572691.0,2018-12-14,6.946,1095.0,"Romance, Drama",English,United States of America
https://www.nytimes.com/2018/12/06/movies/asher-review.html,Ron Perlman and Famke Janssen star in this film that finds a hired killer dealing with his own mortality.,The New York Times,"name: subject, value: Movies, rank: 1, major: N, name: creative_works, value: Asher (Movie), rank: 2, major: N, name: persons, value: Caton-Jones, Michael, rank: 3, major: N, name: persons, value: Perlman, Ron, rank: 4, major: N, name: persons, value: Janssen, Famke, rank: 5, major: N",2018-12-06T12:00:04+0000,259,‘Asher’ Review: An Aging Hit Man Finds Love,,,Asher,,,,By Glenn Kenny,,Asher,267.0,Asher,0.0,en,,"Asher is a former Mossad agent turned gun for hire, living an austere life in an ever-changing Brooklyn. Approaching the end of his career, he breaks the oath he took as a young man when he meets Sophie on a hit gone wrong. In order to have love in his life before it's too late, he must kill the man he was, for a chance at becoming the man he wants to be.",13.234,117.0,0.0,2018-12-07,5.809,138.0,"Thriller, Action, Drama",English,United States of America
https://www.nytimes.com/2018/12/06/movies/the-partys-just-beginning-review.html,The actress Karen Gillan gets glum to play a depressed young woman in her feature directorial debut.,The New York Times,"name: subject, value: Movies, rank: 1, major: N, name: creative_works, value: ""The Partys Just Beginning (Movie)"", rank: 2, major: N, name: persons, value: Pace, Lee, rank: 3, major: N, name: persons, value: Gillan, Karen (1987- ), rank: 4, major: N, name: persons, value: Beard, Matthew (1989- ), rank: 5, major: N",2018-12-06T12:00:01+0000,264,‘The Party’s Just Beginning’ Review: Loss and Love in Inverness,Critic’s Pick,,Topical Depression Above Scotland,,,,By Glenn Kenny,,The Party’s Just Beginning,,,,,,,,,,,,,nan,nan,nan
https://www.nytimes.com/2018/12/06/movies/the-great-pretender-review.html,"In Nathan Silver’s new film, American bros break the hearts of beautiful Frenchwomen. Realism or wishful thinking?",The New York Times,"name: subject, value: Movies, rank: 1, major: N, name: creative_works, value: The Great Pretender (Movie), rank: 2, major: N, name: persons, value: Silver, Nathan (Film Director), rank: 3, major: N, name: persons, value: Garrel, Esther, rank: 4, major: N",2018-12-06T12:00:01+0000,317,‘The Great Pretender’ Review: Tedious Love Affairs in Artsy Brooklyn,,,The Great Pretender,,,,By Glenn Kenny,,The Great Pretender,,,,,,,,,,,,,nan,nan,nan
https://www.nytimes.com/2018/11/29/movies/sicilian-ghost-story-review.html,"Flipping from bucolic to brutal with distressing ease, this beautifully realized movie views a Mafia kidnapping through the prism of first love.",The New York Times,"name: subject, value: Movies, rank: 1, major: N, name: creative_works, value: Sicilian Ghost Story (Movie), rank: 2, major: N, name: persons, value: Grassadonia, Fabio, rank: 3, major: N, name: persons, value: Piazza, Antonio, rank: 4, major: N",2018-11-29T12:00:06+0000,258,‘Sicilian Ghost Story’ Review: Fairy-Tale Love Meets Real-Life Crime,Critic’s Pick,,Love in an Enchanted Forest Turns Eerie,,,,By Jeannette Catsoulis,,Sicilian Ghost Story,273.0,Sicilian Ghost Story,0.0,it,,"In a little Sicilian village at the edge of a forest, Giuseppe, a boy of 13, vanishes. Luna, his classmate who loves him, refuses to accept his mysterious disappearance. She rebels against the silence and complicity that surround her, and to find him she descends into the dark world which has swallowed him up and which has a lake as its mysterious entrance.",6.012,122.0,0.0,2017-11-18,6.6,137.0,"Mystery, Drama, Fantasy",Italian,"France, Italy, Switzerland"
https://www.nytimes.com/2018/11/08/movies/the-new-romantic-review.html,A college newspaper columnist writes about her experiences trading gifts for sex in a film that squanders its good will.,The New York Times,"name: subject, value: Movies, rank: 1, major: N, name: creative_works, value: The New Romantic (Movie), rank: 2, major: N, name: persons, value: Barden, Jessica (1992- ), rank: 3, major: N, name: persons, value: Stone, Carly (Film Director), rank: 4, major: N",2018-11-08T12:05:01+0000,269,‘The New Romantic’ Review: Experiments With Love and Money,,,The New Romantic,,,,By Teo Bugbee,,The New Romantic,275.0,The New Romantic,0.0,en,,"In order to escape her looming post-graduation fate that includes student debt and zero romantic prospects, Blake Conway becomes a sugar baby. As the aspiring journalist and hopeless romantic documents the adventure, she sets out on a quest to figure out if society is right to judge these women and if her own self worth comes with a price.",10.037,82.0,0.0,2018-10-19,6.3,108.0,"Drama, Comedy",English,Canada
https://www.nytimes.com/2018/11/08/movies/pimp-review.html,This lurid melodrama follows a female pimp (Keke Palmer) and her girlfriend-prostitute.,The New York Times,"name: subject, value: Movies, rank: 1, major: N, name: persons, value: Palmer, Keke, rank: 2, major: N, name: persons, value: Gathegi, Edi, rank: 3, major: N, name: persons, value: Crokos, Christine, rank: 4, major: N, name: creative_works, value: Pimp (Movie), rank: 5, major: N",2018-11-08T12:00:01+0000,270,‘Pimp’ Review: Blaxploitation and Lesbian Love,,,Pimp,,,,By Jeannette Catsoulis,,Pimp,277.0,Pimp,0.0,en,,"An urban love story set on the hard streets of the Bronx. A struggling female pimp, named Wednesday, grows up learning the game from her dad. Once he's gone she's left to look out for her prostitute mother and girlfriend Nikki.",14.402,86.0,0.0,2018-11-09,6.3,29.0,Drama,English,United States of America
https://www.nytimes.com/2018/11/08/movies/in-a-relationship-review.html,"Sam Boyd’s gentle, loose-limbed romantic comedy wins no prizes for originality.",The New York Times,"name: subject, value: Movies, rank: 1, major: N, name: persons, value: Roberts, Emma (1991- ), rank: 2, major: N, name: persons, value: Angarano, Michael, rank: 3, major: N, name: persons, value: Hemingway, Dree (1987- ), rank: 4, major: N, name: creative_works, value: In a Relationship (Movie), rank: 5, major: N, name: persons, value: Boyd, Sam (Film Director), rank: 6, major: N",2018-11-08T12:00:01+0000,253,‘In a Relationship’ Review: Two Couples at Opposite Stages of Love,,,In a Relationship,,,,By Jeannette Catsoulis,,In a Relationship,279.0,In a Relationship,0.0,en,,"Long-term couple Owen and Hallie are breaking up—or maybe not?—and just as their relationship reaches a turning point, Matt and Willa embark on a romance of their own.",9.04,92.0,0.0,2018-11-09,5.8,103.0,"Drama, Comedy, Romance",English,"Mexico, United States of America"
https://www.nytimes.com/2018/11/01/movies/theyll-love-me-when-im-dead-review-documentary.html,Morgan Neville’s movie tells the tumultuous behind-the-scenes story of the making and near-unmaking of “The Other Side of the Wind.”,The New York Times,"name: subject, value: Documentary Films and Programs, rank: 1, major: N, name: creative_works, value: ""Theyll Love Me When Im Dead (Movie)"", rank: 2, major: N, name: persons, value: Neville, Morgan, rank: 3, major: N, name: creative_works, value: The Other Side of the Wind (Movie), rank: 4, major: N, name: persons, value: Welles, Orson, rank: 5, major: N",2018-11-01T13:56:39+0000,794,Review: ‘They’ll Love Me When I’m Dead’ Documents Orson Welles’s Last Film,,,The Legend Behind The Scenes,,,,By Manohla Dargis,,They’ll Love Me When I’m Dead’ Documents Orson Welles’s Last Fil,,,,,,,,,,,,,nan,nan,nan
https://www.nytimes.com/2018/10/25/movies/burning-review.html,The great South Korean director Lee Chang-dong’s latest involves three characters subsumed by desire and rage.,The New York Times,"name: subject, value: Movies, rank: 1, major: N, name: creative_works, value: Burning (Movie), rank: 2, major: N, name: persons, value: Lee Chang-dong, rank: 3, major: N, name: persons, value: Yeun, Steven, rank: 4, major: N, name: persons, value: Murakami, Haruki, rank: 5, major: N",2018-10-25T17:39:04+0000,949,"Review: In ‘Burning,’ Love Ignites a Divided World",,,Love Ignites a Divided World,,,,By Manohla Dargis,,"Burning,’ Love Ignites a Divided Worl",,,,,,,,,,,,,nan,nan,nan
https://www.nytimes.com/2018/10/11/movies/after-everything-review.html,This cancer drama focuses less on the high stakes of illness than on how two young people talk to each other in sickness and in health.,The New York Times,"name: subject, value: Movies, rank: 1, major: N, name: creative_works, value: After Everything (Movie), rank: 2, major: N, name: persons, value: White, Jeremy Allen, rank: 3, major: N, name: persons, value: Monroe, Maika, rank: 4, major: N",2018-10-11T11:00:01+0000,268,"Review: In ‘After Everything,’ a Young Love Blooms in Crisis",,,After Everything,,,,By Teo Bugbee,,"After Everything,’ a Young Love Blooms in Crisi",,,,,,,,,,,,,nan,nan,nan
https://www.nytimes.com/2018/09/20/movies/quincy-review-quincy-jones.html,"A documentary reveals its octogenarian subject as still busy and productive, and not a little haunted by memories of friends now gone.",The New York Times,"name: creative_works, value: Quincy (Movie), rank: 1, major: N, name: persons, value: Jones, Quincy, rank: 2, major: N, name: persons, value: Jones, Rashida, rank: 3, major: N, name: persons, value: Hicks, Alan, rank: 4, major: N, name: subject, value: Documentary Films and Programs, rank: 5, major: N, name: subject, value: Music, rank: 6, major: N, name: organizations, value: Netflix Inc, rank: 7, major: N",2018-09-20T14:00:01+0000,460,Review: ‘Quincy’ Captures a Lifelong Love Affair With Music,,,The Man Behind the Music,,,,By Glenn Kenny,,Quincy’ Captures a Lifelong Love Affair With Musi,,,,,,,,,,,,,nan,nan,nan
https://www.nytimes.com/2018/09/20/movies/love-gilda-review-saturday-night-live-documentary.html,"Adding to the booming genre of comedian documentaries, this film is an affectionate portrait of one of the first major stars of “Saturday Night Live.”",The New York Times,"name: subject, value: Documentary Films and Programs, rank: 1, major: N, name: creative_works, value: Love, Gilda (Movie), rank: 2, major: N, name: persons, value: Radner, Gilda, rank: 3, major: N, name: persons, value: ""DApolito, Lisa"", rank: 4, major: N, name: creative_works, value: Saturday Night Live (TV Program), rank: 5, major: N, name: subject, value: Television, rank: 6, major: N, name: subject, value: Comedy and Humor, rank: 7, major: N",2018-09-20T11:00:01+0000,421,"Review: In ‘Love, Gilda,’ a Portrait of a Brief and Brilliant Career",,,"Eccentric Charm, Raucous Abandon",,,,By Jason Zinoman,,"Love, Gilda,’ a Portrait of a Brief and Brilliant Caree",,,,,,,,,,,,,nan,nan,nan
